{
  "schema": "PAFContextContinuitySnapshot",
  "version": "1.0",
  "snapshotDateTime": "2026-08-13T18:23:32-04:00",
  "packageChain": {
    "thisPackageId": "PAF-STEPS-1-72-PACKAGE",
    "immutableCorpusHash": "0edd9d5b0993e974ec9141e4b72116dad4e6bf238173cf08a775e7c4be778f0e",
    "predecessorPackageHash": "9eb5021f3d51bf71f56d9fc7dbace82e0b3674445b8a13d65e64ee364e3aa60b",
    "predecessorPackageId": "PAF-RUN7A-CONTINUATION-v1.0"
  },
  "frameworkStepRangeCompleted": [
    1,
    2,
    3,
    4,
    5,
    6,
    7,
    8,
    9,
    10,
    11,
    12,
    13,
    14,
    15,
    16,
    17,
    18,
    19,
    20,
    21,
    22,
    23,
    24,
    25,
    26,
    27,
    28,
    29,
    30,
    31,
    32,
    33,
    34,
    35,
    36,
    37,
    38,
    39,
    40,
    41,
    42,
    43,
    44,
    45,
    46,
    47,
    48,
    49,
    50,
    51,
    52,
    53,
    54,
    55,
    56,
    57,
    58,
    59,
    60,
    61,
    62,
    63,
    64,
    65,
    66,
    67,
    68,
    69,
    70,
    71,
    72
  ],
  "currentStep": 72,
  "currentLifecycleState": "STABLE",
  "governanceBaseline": {
    "buildPolicy": "Build Requirements & Architecture Policy v1.2",
    "sourceResponsibilityModel": "Agent Source & Responsibility Model v0.4",
    "immutableOverlay": "999 Canon Modification Tracker v0.4",
    "designAuthority": "DDR 201 v1.37 + overlays",
    "auditGate": "CLEARED (D3 v1.2 post-D4)",
    "frameworkStatus": "APPROVED AND FROZEN \u2014 Agent Framework v1.0 (APR-002). Now authoritative for ProjectOne build governance.",
    "productionImplementation": "NOT AUTHORIZED"
  },
  "activeArtifactVersions": {
    "frameworkVersion": "1.0 FROZEN (core byte-identical since freeze)",
    "baselineVersion": "1.1 (v1.0 + CP-001)",
    "profile": "1.1 ACTIVE",
    "components": "131 frozen with SHA-256",
    "approvals": "APR-001, APR-002, CP-001",
    "activationCheckpoint": "PASS 34/34",
    "validation": "9/9 suites",
    "repository": "https://github.com/jpsims68/ProjectOne \u2014 15 files in main, protection + tag rulesets Active, 6 required checks pinned to GitHub Actions"
  },
  "decisionsMadeSincePriorSnapshot": [
    {
      "id": "Steps 63-72",
      "status": "COMPLETE \u2014 owner-executed, independently verified by clone"
    },
    {
      "id": "F-R8-01",
      "status": "Material workflow defect found and corrected \u2014 PR edit did not re-trigger governance check"
    },
    {
      "id": "OF-01..03",
      "status": "Three owner findings; OF-03 (Any source) prevented forgeable status checks"
    },
    {
      "id": "Sourcery AI",
      "status": "SUSPENDED \u2014 had write access to the PR evidence surface"
    }
  ],
  "openDecisions": [
    {
      "id": "OD-05",
      "subject": "Independent clean-context review of verification mechanism mapping",
      "status": "OPEN \u2014 recommended"
    },
    {
      "id": "OD-06",
      "subject": "603-Activities_Groupings_for_Mapping.md acquisition",
      "requiredBy": "before D-38 grouping-seed work",
      "status": "OPEN"
    },
    {
      "id": "OD-07",
      "subject": "Confirm no Sourcery check appears on the next PR",
      "status": "OPEN \u2014 follow-up on suspended third-party access"
    },
    {
      "id": "OD-08",
      "subject": "Set required approvals to 1 when a second human joins",
      "status": "OPEN \u2014 change trigger, not currently actionable"
    }
  ],
  "openRisks": [
    {
      "id": "R-01",
      "risk": "Remote GitHub/CI unavailable on this platform",
      "impact": "Steps 63-72,91,101,110 require owner execution",
      "status": "OPEN - disposition due Step 57"
    },
    {
      "id": "R-02",
      "risk": "Run may terminate before export",
      "mitigation": "mid-run checkpoint + complete export at run end",
      "status": "MITIGATED - moderate confidence"
    }
  ],
  "openExceptions": [],
  "unconfiguredControlWarnings": [],
  "blockingConditions": [],
  "testsAndEvidenceProduced": [
    {
      "id": "EV-R8-01",
      "name": "Steps 63-72 evidence record",
      "method": "OWNER_EXECUTION + DETERMINISTIC_CHECK",
      "result": "10/10 steps PASS",
      "location": "evidence/SETUP-001/steps-63-72-evidence.json"
    },
    {
      "id": "EV-R8-02",
      "name": "Branch protection verified by rejection",
      "method": "OWNER_EXECUTION",
      "result": "Direct commit to main REFUSED with no override offered"
    },
    {
      "id": "EV-R8-03",
      "name": "Live repository independently verified",
      "method": "DETERMINISTIC_CHECK",
      "result": "15 files in main; governance checks re-run against live repo PASS; workflow trigger fix confirmed present"
    },
    {
      "id": "EV-R8-04",
      "name": "Framework regression",
      "method": "DETERMINISTIC_CHECK",
      "result": "PASS 9/9 suites",
      "reproduce": "python3 validation/run_all_validation.py <core_dir>"
    }
  ],
  "filesCreatedOrChanged": [],
  "humanApprovalsObtained": [
    {
      "gate": "Run 1 foundation decisions D-PAF-01..04",
      "approver": "John",
      "date": "2026-08-13",
      "mechanism": "explicit chat ratification"
    },
    {
      "gate": "Step 49 sustainability thresholds (APR-001)",
      "approver": "John",
      "date": "2026-08-13",
      "mechanism": "explicit review of approval package"
    },
    {
      "gate": "Step 54 Agent Framework v1 (APR-002)",
      "approver": "John",
      "date": "2026-08-13",
      "mechanism": "explicit review of approval package"
    }
  ],
  "nextAuthorizedAction": "Steps 73-79: repository assembly \u2014 initial ProjectOne scaffold and adapter configuration committed into the repository. Assistant produces content; owner commits via PR under the now-enforced controls. Note: every future change must pass 6 required checks and cannot be pushed directly to main.",
  "doNotDo": [
    "Do NOT edit any frozen artifact in place \u2014 governed change package + new baseline version only",
    "Do NOT record any GitHub step as passing unless the owner actually executed it and returned output",
    "Do NOT write anything to the baseline after generating a freeze manifest (F-R7-02)",
    "Do NOT proceed past Step 112 without explicit owner authorization for Step 113",
    "Do NOT treat the 360/360 verification figure as independently verified (OD-05)",
    "Do NOT infer approval from silence",
    "Do NOT add a third-party app to required status checks \u2014 an external service must never block or unblock a merge",
    "Do NOT leave required-check source as 'Any source' \u2014 it permits forgeable check results",
    "Do NOT describe human-review independence on this repo as enforced; it is attested"
  ],
  "resumeInstructions": "STANDING INSTRUCTION FOR ANY SUCCESSOR SESSION: (1) Always reply in plain terms, briefly, beginning every message with 'in concise and plain terms: '. (2) At the end of EVERY run, give the owner brief explicit directions on which files to download and what to re-upload next time. RESUME PROCEDURE: (a) Verify the re-uploaded Core package SHA-256 equals packageChain.immutableCorpusHash; a mismatch is a STOP condition. (b) Verify this continuation package against its SHA256SUMS.txt. (c) Confirm predecessorPackageHash chains correctly. (d) Re-run all validators: validate_framework.py (15/15), validate_run2.py (21/21), validate_run3.py (18/18), validate_run4.py <core> (16/16), validate_run5.py (15/15), conformance_probe.py <core> (5/5). All must pass before new work. (e) Read PAF-SPEC v0.2 and PAF-FDR v1.0. (f) Proceed to Run 2 (Steps 11-20). Never assume prior container files exist."
}